{
  "refId": "stripe/api-payment-intents-object",
  "sourceUrl": "https://docs.stripe.com/api/payment_intents/object.md",
  "lastVerified": "2026-06-03",
  "title": "The PaymentIntent object",
  "excerpt": "String representing the object’s type. Objects of the same type share the same value. Amount intended to be collected by this PaymentIntent. A positive integer representing how much to charge in the [smallest currency unit](https://docs.stripe.com/docs/currencies.md#zero-decimal) (e.g., 100 cents to charge $1.00 or 100 to charge ¥100, a zero-decimal currency). The minimum amount is $0.50 US or [equivalent in charge currency](https://docs.stripe.com/docs/currencies.md#minimum-and-maximum-charge-amounts). The amount value supports up to eight digits (e.g., a value of 99999999 for a USD charge of $999,999.99). Amount that can be captured from this PaymentIntent. Provides industry-specific information about the amount.…",
  "appliesTo": [
    "billing-subscription",
    "layer2/stripe"
  ],
  "tags": [
    "stripe",
    "p1"
  ]
}
