{
  "refId": "cloudflare/workers-platform-limits-index",
  "sourceUrl": "https://developers.cloudflare.com/workers/platform/limits/index.md",
  "lastVerified": "2026-06-03",
  "title": "Limits",
  "excerpt": "description: Cloudflare Workers plan and platform limits. image: https://developers.cloudflare.com/dev-products-preview.png > Fetch the complete documentation index at: https://developers.cloudflare.com/workers/llms.txt > Use this file to discover all available pages before exploring further. | Feature | Workers Free | Workers Paid | | ------------------------------------------------------------------------------------------------------------ | ------------ | -------------- |",
  "appliesTo": [
    "cloudflare-golden-stack",
    "layer2/cloudflare"
  ],
  "tags": [
    "cloudflare",
    "p0"
  ]
}
