{
  "refId": "resend/docs-knowledge-base-how-do-i-set-up-apple-branded-mail",
  "sourceUrl": "https://resend.com/docs/knowledge-base/how-do-i-set-up-apple-branded-mail.md",
  "lastVerified": "2026-06-03",
  "title": "How do I set up Apple Branded Mail?",
  "excerpt": "> ## Documentation Index > Fetch the complete documentation index at: https://resend.com/docs/llms.txt > Use this file to discover all available pages before exploring further. # How do I set up Apple Branded Mail? > Learn how to implement Apple Branded Mail to display your logo in Apple Mail clients. export const YouTube = ({id}) => { return ; }; ## Prerequisites To get the most out of this guide, you will need to: * [Create an Apple Business Connect account](https://www.apple.com/business/connect/) * [Setup DMARC on your domain](/dashboard/domains/dmarc) * A company identification number for Apple to verify your company Prefer watching a video? Check out our video walkthrough below.…",
  "appliesTo": [
    "auth-lifecycle",
    "email-lifecycle",
    "resend"
  ],
  "tags": [
    "resend",
    "p1"
  ]
}
