{
  "refId": "cloudflare/pages-framework-guides-nextjs-deploy-a-static-nextjs-site-index",
  "sourceUrl": "https://developers.cloudflare.com/pages/framework-guides/nextjs/deploy-a-static-nextjs-site/index.md",
  "lastVerified": "2026-06-03",
  "title": "Static site",
  "excerpt": "description: Deploy a static site built using Next.js to Cloudflare Pages image: https://developers.cloudflare.com/dev-products-preview.png > Fetch the complete documentation index at: https://developers.cloudflare.com/pages/llms.txt > Use this file to discover all available pages before exploring further. Do not use this guide unless you have a specific use case for static exports. Cloudflare recommends using Workers to deploy your Next.js site, for more instructions refer the [Next.js Workers guide](https://developers.cloudflare.com/workers/framework-guides/web-apps/nextjs). [Next.js ↗](https://nextjs.org) is an open-source React framework for creating websites and applications. In this guide, you will create a new Next.js application and deploy it using Cloudflare Pages.",
  "appliesTo": [
    "cloudflare-golden-stack",
    "layer2/cloudflare"
  ],
  "tags": [
    "cloudflare",
    "p0"
  ]
}
