{
  "refId": "resend/docs-dashboard-segments-migrating-from-audiences-to-segments",
  "sourceUrl": "https://resend.com/docs/dashboard/segments/migrating-from-audiences-to-segments.md",
  "lastVerified": "2026-06-03",
  "title": "Migrating from Audiences to Segments",
  "excerpt": "> ## Documentation Index > Fetch the complete documentation index at: https://resend.com/docs/llms.txt > Use this file to discover all available pages before exploring further. # Migrating from Audiences to Segments > Learn how to migrate from Audiences to Segments We've recently changed how Contacts are segmented. Before, each Contact was part of one Audience and if you created another contact with the same email address in a different Audience, it would be a completely separate object. In the new model, Contacts are now independent of Audiences, which are now called Segments. A Contact can be in zero, one or multiple Segments and still count as one when calculating your quota usage. Contacts API endpoints that previously required an `audience_id` can now be used directly instead.…",
  "appliesTo": [
    "auth-lifecycle",
    "email-lifecycle",
    "resend"
  ],
  "tags": [
    "resend",
    "p1"
  ]
}
