{
  "refId": "resend/docs-api-reference-contacts-create-contact",
  "sourceUrl": "https://resend.com/docs/api-reference/contacts/create-contact.md",
  "lastVerified": "2026-06-03",
  "title": "Create Contact",
  "excerpt": "> ## Documentation Index > Fetch the complete documentation index at: https://resend.com/docs/llms.txt > Use this file to discover all available pages before exploring further. # Create Contact > Create a contact. export const ResendParamField = ({children, body, path, ...props}) => { const [lang, setLang] = useState(() => { return localStorage.getItem('code') || '\"Node.js\"'; }); useEffect(() => { const onStorage = event => { const key = event.detail.key; if (key === 'code') { setLang(event.detail.value); } }; document.addEventListener('mintlify-localstorage', onStorage); return () => { document.removeEventListener('mintlify-localstorage', onStorage); }; }, []); const toCamelCase = str => typeof str === 'string' ? str.replace(/[_-](\\w)/g, (_, c) => c.toUpperCase()) : str; const resolvedBod…",
  "appliesTo": [
    "auth-lifecycle",
    "email-lifecycle",
    "resend"
  ],
  "tags": [
    "resend",
    "p0"
  ]
}
