{
  "refId": "ironcannon/scale-c2-compose-173",
  "sourceUrl": "https://ironcannon.dev/planning/corpus/ironcannon/scale-c2-compose-173",
  "lastVerified": "2026-06-03",
  "title": "Scale-C2 compose 173",
  "excerpt": "Compose empty rejected when wiremap has zero modules. Planning reference card 173 for Iron Cannon compose and compliance agents. Cross-ref obligations and EM-3 touchpoints.",
  "tags": [
    "ironcannon",
    "compose",
    "scale-c2"
  ]
}
