{
  "refId": "resend/docs-webhooks-contacts-deleted",
  "sourceUrl": "https://resend.com/docs/webhooks/contacts/deleted.md",
  "lastVerified": "2026-06-03",
  "title": "contact.deleted",
  "excerpt": "> ## Documentation Index > Fetch the complete documentation index at: https://resend.com/docs/llms.txt > Use this file to discover all available pages before exploring further. # contact.deleted > Received when a contact is deleted. export const ResponseBodyParameters = ({type, children}) => { return Response Body Parameters All webhook payloads follow a consistent top-level structure with event-specific data nested within the data object. The event type that triggered the webhook (e.g., {type} ). ISO 8601 timestamp when the webhook event was created. Event-specific data containing detailed information about the event. The data object for the {type} event contains the following parameters: {children} ; }; Event triggered whenever a **contact was successfully deleted**.…",
  "appliesTo": [
    "auth-lifecycle",
    "email-lifecycle",
    "resend"
  ],
  "tags": [
    "resend",
    "p0"
  ]
}
