{
  "refId": "cloudflare/r2-examples-aws-s3mini-index",
  "sourceUrl": "https://developers.cloudflare.com/r2/examples/aws/s3mini/index.md",
  "lastVerified": "2026-06-03",
  "title": "s3mini",
  "excerpt": "description: Configure s3mini, a lightweight TypeScript S3 client, to work with Cloudflare R2. image: https://developers.cloudflare.com/dev-products-preview.png > Fetch the complete documentation index at: https://developers.cloudflare.com/r2/llms.txt > Use this file to discover all available pages before exploring further. You must [generate an Access Key](https://developers.cloudflare.com/r2/api/tokens/) before getting started. All examples will utilize `access_key_id` and `access_key_secret` variables which represent the **Access Key ID** and **Secret Access Key** values you generated. [s3mini ↗](https://www.npmjs.com/package/s3mini) is a zero-dependency, lightweight (\\~20 KB minified) TypeScript S3 client that uses AWS SigV4 signing.…",
  "appliesTo": [
    "cloudflare-golden-stack",
    "layer2/cloudflare"
  ],
  "tags": [
    "cloudflare",
    "p0"
  ]
}
