{
  "refId": "nextjs/docs-app-guides-custom-server",
  "sourceUrl": "https://nextjs.org/docs/app/guides/custom-server",
  "lastVerified": "2026-06-05",
  "title": "Custom Server",
  "excerpt": "Guides: Custom Server | Next.js Skip to content Search documentation... Search... ⌘K Showcase Docs Blog Templates Enterprise Search documentation... Search... ⌘K Feedback Learn NEXT.JS NIGHTS SF JUN 9 • AMS JUN 11 • LDN JUN 18 VIEW EVENTS › Menu Using App Router Features available in /app Latest Version 16.2.7 Getting Started Installation Project Structure Layouts and Pages Linking and Navigating Server and Client Components Fetching Data Mutating Data Caching Revalidating Error Handling CSS Image Optimization Font Optimization Metadata and OG images Route Handlers Proxy Deploying Upgrading Guides AI Coding Agents Analytics Authentication Backend for Frontend Caching (Previous Model) CDN Caching CI Build Caching Content Security Policy CSS-in-JS Custom Server Data Security Debugging Deploy…",
  "appliesTo": [
    "nextjs-app-router",
    "layer2/nextjs"
  ],
  "tags": [
    "nextjs",
    "p1"
  ]
}
